{
  "$schema": "./lodging-identity.schema.json",
  "lodgingId": 27,
  "name": "Hostel La Plata Centro",
  "category": "hostel",
  "location": {
    "city": "La Plata",
    "country": "Argentina"
  },
  "capacity": 8,
  "version": 1,
  "status": "approved",
  "source": "recovered-from-approved-context",
  "identity": {
    "positioning": "Hostel económico, sencillo y limpio para estudiantes, grupos y viajeros jóvenes, con capacidad para hasta ocho huéspedes por dormitorio representado. Debe transmitir mantenimiento, orden y funcionalidad; sin lujo, deterioro, estética infantil, tematización universitaria ni vistas inventadas de la Catedral de La Plata.",
    "architecture": "Casa urbana reciclada de una sola planta. Fachada simple de revoque gris claro y blanco cálido. Acceso directo desde una calle céntrica. Aberturas de proporción residencial. Dormitorios compartidos distribuidos alrededor de una circulación central. Cocina, comedor y espacio de estudio integrados. Baños compartidos agrupados. Pequeños patios para iluminación y ventilación. Patio trasero con parrilla. Guardado seguro para equipaje. Instalaciones actualizadas y accesibles para mantenimiento. Sin ampliaciones improvisadas, decoración institucional ni referencias arquitectónicas a la universidad o la catedral.",
    "palette": [
      "gris claro",
      "blanco cálido",
      "azul medio",
      "mostaza apagado",
      "madera clara",
      "grafito",
      "beige como tono complementario"
    ],
    "floors": "Acceso y áreas comunes: mosaico granítico restaurado. Dormitorios: piso vinílico resistente tono madera clara. Cocina, comedor y estudio: porcelanato gris mate. Baños: porcelanato antideslizante gris claro. Duchas: cerámica blanca y azul medio. Patios: baldosas exteriores gris y terracota suave. Sin alfombras, pisos delicados ni superficies deterioradas artificialmente.",
    "wallsAndFinishes": "Muros generales en blanco cálido. Paños azul medio para orientar circulaciones. Mostaza apagado en sectores pequeños. Zócalos lavables en dormitorios. Cocina con frente de cerámica blanca. Baños revestidos hasta una altura funcional. Espacio de estudio con paneles acústicos grises. Sin murales universitarios, pizarrones decorativos, escudos, mapas turísticos ni imágenes de la catedral.",
    "joinery": "Ventanas de aluminio grafito o madera restaurada. Puertas interiores lisas de madera clara. Puertas de baños resistentes a humedad. Lockers individuales metálicos grafito. Muebles de cocina laminados en blanco y madera. Mamparas resistentes con perfilería grafito. Herrajes negros satinados. Cortinas simples, claras y lavables.",
    "furniture": "Cuchetas metálicas grafito con estructura firme. Cortina, luz, toma y estante por cama. Lockers individuales para ocho huéspedes. Mesas comunitarias de madera clara. Sillas resistentes y apilables. Escritorios compartidos para estudio o trabajo. Cocina equipada con guardado identificado. Sofás modulares con fundas lavables. Bancos y mesas exteriores junto a la parrilla. Sin mobiliario escolar infantil, pallets improvisados ni piezas de lujo.",
    "lighting": "Temperatura cálida entre 2700 y 3000 K. Luz individual de lectura en cada cama. Iluminación general uniforme. Luz lineal bajo alacenas. Lámparas de tarea en el espacio de estudio. Plafones resistentes a humedad en baños. Colgantes simples sobre mesas. Apliques cálidos en patios. Sin luces RGB, neón, iluminación institucional ni ambientes oscuros.",
    "continuityElements": [
      "Casa urbana reciclada de una sola planta.",
      "Gris claro y blanco cálido como base.",
      "Azul medio para orientar y dar identidad.",
      "Mostaza apagado como acento puntual.",
      "Madera clara y metal grafito.",
      "Equipamiento durable y lavable.",
      "Espacio integrado de cocina, comedor y estudio.",
      "Relación constante entre dormitorios, pequeños patios y patio trasero con parrilla."
    ],
    "recommendedScenes": [
      {
        "order": 1,
        "title": "Fachada urbana reciclada",
        "brief": "Mostrar la fachada urbana reciclada, simple y bien mantenida."
      },
      {
        "order": 2,
        "title": "Dormitorio compartido",
        "brief": "Mostrar el dormitorio compartido con cuchetas y lockers para ocho huéspedes."
      },
      {
        "order": 3,
        "title": "Baño compartido",
        "brief": "Mostrar el baño compartido resistente, limpio y bien iluminado."
      },
      {
        "order": 4,
        "title": "Cocina, comedor y estudio",
        "brief": "Mostrar la cocina, el comedor y el espacio de estudio integrados."
      },
      {
        "order": 5,
        "title": "Patio trasero y parrilla",
        "brief": "Mostrar el patio trasero sin personas, con mesas y parrilla, sin vistas inventadas de la catedral."
      }
    ]
  }
}
