{
  "$schema": "./lodging-identity.schema.json",
  "lodgingId": 29,
  "name": "Hostel San Telmo",
  "category": "hostel",
  "location": {
    "city": "Buenos Aires",
    "country": "Argentina"
  },
  "capacity": 10,
  "version": 1,
  "status": "approved",
  "source": "recovered-from-approved-context",
  "identity": {
    "positioning": "Hostel social y bohemio para viajeros jóvenes y grupos, con capacidad para hasta diez huéspedes por dormitorio representado. Debe expresar creatividad, vida urbana y carácter porteño mediante materiales reales y espacios compartidos; sin parecer una discoteca, una galería de grafitis, una escenografía de tango ni una acumulación de objetos vintage.",
    "architecture": "Casa urbana restaurada de dos plantas. Organización alrededor de un patio central. Fachada histórica sobria con puerta alta. Revoque gris verdoso y blanco cálido. Galerías interiores conectando dormitorios. Aberturas verticales restauradas. Dormitorios compartidos en ambas plantas. Cocina, comedor y estar vinculados con el patio. Baños compartidos agrupados. Terraza accesible en la azotea. Parrilla y mobiliario social en la terraza. Instalaciones nuevas integradas sin alterar la arquitectura. Sin pista de baile, escenario, murales invasivos ni decoración temática de tango.",
    "palette": [
      "gris verdoso",
      "blanco cálido",
      "terracota",
      "azul petróleo",
      "madera oscura",
      "mostaza apagado",
      "negro mate como tono complementario"
    ],
    "floors": "Acceso y dormitorios: pinotea restaurada y correctamente sellada. Patio y galerías: baldosas calcáreas recuperadas. Cocina y comedor: porcelanato gris mate. Baños: porcelanato antideslizante gris claro. Duchas: cerámica blanca con detalles petróleo. Terraza: baldosa exterior terracota antideslizante. Escalera: madera restaurada con protección de alto tránsito. Sin cemento deteriorado, pisos deliberadamente envejecidos ni superficies delicadas.",
    "wallsAndFinishes": "Muros generales en blanco cálido y gris verdoso. Paños de ladrillo original restaurado utilizados con moderación. Azul petróleo para orientar sectores. Cocina con frente de cerámica mostaza apagada. Baños revestidos hasta altura funcional. Patio con revoque mineral y baldosas calcáreas. Gráfica contemporánea de pequeña escala. Sin grafitis decorativos, bandoneones, retratos de tangueros, carteles antiguos ni collage vintage.",
    "joinery": "Puerta principal alta de madera oscura. Ventanas originales de madera restaurada. Puertas interiores resistentes de madera. Lockers individuales metálicos negros. Muebles de cocina en madera oscura y gris. Divisores de ducha con perfilería negra. Herrajes negros satinados. Cortinas simples en beige y petróleo.",
    "furniture": "Cuchetas metálicas negras con cortinas individuales. Luz, toma y estante por cama. Lockers para diez huéspedes. Mesas comunitarias de madera oscura. Sillas variadas pero coordinadas y resistentes. Sofás modulares con fundas lavables. Cocina equipada para grupos. Bancos y mesas en patio. Mobiliario bajo en la terraza. Parrilla integrada sin protagonismo escenográfico. Sin pallets, sillones rotos, mobiliario de club nocturno ni acumulación de antigüedades.",
    "lighting": "Temperatura cálida entre 2700 y 3000 K. Luz individual de lectura en cada cama. Iluminación uniforme en dormitorios y baños. Colgantes simples sobre mesas comunitarias. Apliques negros en galerías. Luz lineal bajo alacenas. Balizas en escaleras, patio y terraza. Atardecer como protagonista en la azotea. Sin neón, luces de colores, bolas espejadas ni iluminación teatral.",
    "continuityElements": [
      "Casa restaurada de dos plantas con patio central.",
      "Pinotea y baldosas calcáreas recuperadas.",
      "Gris verdoso y blanco cálido como base.",
      "Terracota en patio y terraza.",
      "Azul petróleo y mostaza apagado como acentos.",
      "Madera oscura y metal negro.",
      "Mobiliario ecléctico pero coordinado y durable.",
      "Relación continua entre dormitorios, galerías, patio, cocina y terraza."
    ],
    "recommendedScenes": [
      {
        "order": 1,
        "title": "Fachada restaurada",
        "brief": "Mostrar la fachada restaurada con puerta alta de madera."
      },
      {
        "order": 2,
        "title": "Dormitorio compartido",
        "brief": "Mostrar el dormitorio compartido con cuchetas, lockers y la galería visible."
      },
      {
        "order": 3,
        "title": "Baño compartido",
        "brief": "Mostrar el baño compartido limpio y resistente."
      },
      {
        "order": 4,
        "title": "Cocina, comedor y patio",
        "brief": "Mostrar la cocina, el comedor y el estar conectados con el patio."
      },
      {
        "order": 5,
        "title": "Terraza al atardecer",
        "brief": "Mostrar la terraza al atardecer, sin personas, con mesas y parrilla."
      }
    ]
  }
}
